{
  "envelopeVersion": 1,
  "generator": {
    "name": "rtdb-bridge",
    "version": "0.1.0",
    "pipelineVersion": 1
  },
  "source": {
    "format": "rtdb-export-json",
    "name": "stress_test",
    "recordCount": 14,
    "collectionCount": 3
  },
  "database": {
    "name": "stress_test",
    "tables": [
      {
        "name": "accounts",
        "type": "table",
        "sourceCollection": null,
        "rowCount": 3,
        "columnCount": 5,
        "columns": [
          {
            "name": "record_id",
            "type": "string",
            "uiType": "string",
            "sqlType": "VARCHAR(65535)",
            "nullable": false,
            "partial": false
          },
          {
            "name": "owner",
            "type": "string",
            "uiType": "string",
            "sqlType": "VARCHAR(65535)",
            "nullable": false,
            "partial": false
          },
          {
            "name": "active",
            "type": "boolean",
            "uiType": "boolean",
            "sqlType": "BOOLEAN",
            "nullable": false,
            "partial": false
          },
          {
            "name": "account_settings",
            "type": "string",
            "uiType": "string",
            "sqlType": "VARCHAR(65535)",
            "nullable": false,
            "partial": false
          },
          {
            "name": "preferences",
            "type": "string",
            "uiType": "string",
            "sqlType": "VARCHAR(65535)",
            "nullable": false,
            "partial": false
          }
        ],
        "primaryKey": [
          "record_id"
        ],
        "indexes": [],
        "foreignKeys": [
          {
            "name": "accounts_account_settings_fk",
            "column": "account_settings",
            "refTable": "accounts_account_settings",
            "refColumn": "record_id",
            "cardinality": "1:N"
          },
          {
            "name": "accounts_preferences_fk",
            "column": "preferences",
            "refTable": "accounts_preferences",
            "refColumn": "record_id",
            "cardinality": "1:N"
          }
        ]
      },
      {
        "name": "accounts_account_settings",
        "type": "table",
        "sourceCollection": null,
        "rowCount": 4,
        "columnCount": 7,
        "columns": [
          {
            "name": "account_settings_name",
            "type": "string",
            "uiType": "string",
            "sqlType": "VARCHAR(65535)",
            "nullable": false,
            "partial": false
          },
          {
            "name": "account_settings_value",
            "type": "mixed",
            "uiType": "mixed",
            "types": [
              "boolean",
              "string"
            ],
            "sqlType": null,
            "nullable": true,
            "partial": true,
            "choiceOf": [
              {
                "name": "account_settings_value_bool",
                "type": "boolean",
                "sqlType": "BOOLEAN",
                "nullable": true,
                "partial": true
              },
              {
                "name": "account_settings_value_str",
                "type": "string",
                "sqlType": "VARCHAR(65535)",
                "nullable": true,
                "partial": true
              }
            ]
          },
          {
            "name": "account_settings_record_id",
            "type": "string",
            "uiType": "string",
            "sqlType": "VARCHAR(65535)",
            "nullable": false,
            "partial": false
          },
          {
            "name": "account_settings__rid_",
            "type": "string",
            "uiType": "string",
            "sqlType": "VARCHAR(65535)",
            "nullable": false,
            "partial": false
          },
          {
            "name": "account_settings__index_",
            "type": "number",
            "uiType": "number",
            "sqlType": "BIGINT",
            "nullable": false,
            "partial": false
          },
          {
            "name": "account_settings_value_mode",
            "type": "string",
            "uiType": "string",
            "sqlType": "VARCHAR(65535)",
            "nullable": true,
            "partial": true
          },
          {
            "name": "account_settings_value_font_size",
            "type": "number",
            "uiType": "number",
            "sqlType": "BIGINT",
            "nullable": true,
            "partial": true
          }
        ],
        "primaryKey": [
          "record_id"
        ],
        "indexes": [],
        "foreignKeys": []
      },
      {
        "name": "accounts_preferences",
        "type": "table",
        "sourceCollection": null,
        "rowCount": 3,
        "columnCount": 5,
        "columns": [
          {
            "name": "preferences_key",
            "type": "string",
            "uiType": "string",
            "sqlType": "VARCHAR(65535)",
            "nullable": false,
            "partial": false
          },
          {
            "name": "preferences_enabled",
            "type": "mixed",
            "uiType": "mixed",
            "types": [
              "boolean",
              "string"
            ],
            "sqlType": null,
            "nullable": true,
            "partial": true,
            "choiceOf": [
              {
                "name": "preferences_enabled_bool",
                "type": "boolean",
                "sqlType": "BOOLEAN",
                "nullable": true,
                "partial": true
              },
              {
                "name": "preferences_enabled_str",
                "type": "string",
                "sqlType": "VARCHAR(65535)",
                "nullable": true,
                "partial": true
              }
            ]
          },
          {
            "name": "preferences_record_id",
            "type": "string",
            "uiType": "string",
            "sqlType": "VARCHAR(65535)",
            "nullable": false,
            "partial": false
          },
          {
            "name": "preferences__rid_",
            "type": "string",
            "uiType": "string",
            "sqlType": "VARCHAR(65535)",
            "nullable": false,
            "partial": false
          },
          {
            "name": "preferences__index_",
            "type": "number",
            "uiType": "number",
            "sqlType": "BIGINT",
            "nullable": false,
            "partial": false
          }
        ],
        "primaryKey": [
          "record_id"
        ],
        "indexes": [],
        "foreignKeys": []
      },
      {
        "name": "devices",
        "type": "table",
        "sourceCollection": null,
        "rowCount": 3,
        "columnCount": 4,
        "columns": [
          {
            "name": "record_id",
            "type": "string",
            "uiType": "string",
            "sqlType": "VARCHAR(65535)",
            "nullable": false,
            "partial": false
          },
          {
            "name": "serial",
            "type": "string",
            "uiType": "string",
            "sqlType": "VARCHAR(65535)",
            "nullable": true,
            "partial": false
          },
          {
            "name": "owner_ref",
            "type": "string",
            "uiType": "string",
            "sqlType": "VARCHAR(65535)",
            "nullable": false,
            "partial": false
          },
          {
            "name": "revision",
            "type": "mixed",
            "uiType": "mixed",
            "types": [
              "number",
              "string"
            ],
            "sqlType": null,
            "nullable": true,
            "partial": true,
            "choiceOf": [
              {
                "name": "revision_int",
                "type": "number",
                "sqlType": "BIGINT",
                "nullable": true,
                "partial": true
              },
              {
                "name": "revision_str",
                "type": "string",
                "sqlType": "VARCHAR(65535)",
                "nullable": true,
                "partial": true
              }
            ]
          }
        ],
        "primaryKey": [
          "record_id"
        ],
        "indexes": [],
        "foreignKeys": []
      },
      {
        "name": "users",
        "type": "table",
        "sourceCollection": null,
        "rowCount": 8,
        "columnCount": 23,
        "columns": [
          {
            "name": "record_id",
            "type": "string",
            "uiType": "string",
            "sqlType": "VARCHAR(65535)",
            "nullable": false,
            "partial": false
          },
          {
            "name": "name",
            "type": "string",
            "uiType": "string",
            "sqlType": "VARCHAR(65535)",
            "nullable": false,
            "partial": false
          },
          {
            "name": "age",
            "type": "mixed",
            "uiType": "mixed",
            "types": [
              "number",
              "string"
            ],
            "sqlType": null,
            "nullable": true,
            "partial": true,
            "choiceOf": [
              {
                "name": "age_int",
                "type": "number",
                "sqlType": "BIGINT",
                "nullable": true,
                "partial": true
              },
              {
                "name": "age_str",
                "type": "string",
                "sqlType": "VARCHAR(65535)",
                "nullable": true,
                "partial": true
              }
            ]
          },
          {
            "name": "settings_color",
            "type": "string",
            "uiType": "string",
            "sqlType": "VARCHAR(65535)",
            "nullable": true,
            "partial": true
          },
          {